{
  "schema": "axm-tools/manzanita-review-decision@1",
  "decision_id": "M99-RB-DEC-010",
  "packet_id": "M99-RB-PKT-010",
  "board_id": "M99-CONTAINED-REVIEW-BOARD",
  "board_version": "1.0.0",
  "reviewed_ref": {
    "binding": "validation_head",
    "ref": "GITHUB_SHA"
  },
  "external_review_claim": false,
  "seat_reviews": [
    {
      "seat_id": "board_chair",
      "disposition": "pass_with_findings",
      "findings": [
        "The board chair review finds the exact automated P8 mechanism internally admissible for the evidence classes it actually exercises.",
        "The board chair review retains every real assistive-technology, human, device, network, private, provider, field, archive, public, rollback, score, and constitutional-count boundary applicable to this seat."
      ],
      "evidence_ids": ["E-Q-CONTRACT", "E-Q-REPORT", "E-BOARD-CHARTER"],
      "uncertainty": "Independent physical, human, provider, field, archive, deployed, and public campaigns remain outside this automated decision.",
      "veto_ids": []
    },
    {
      "seat_id": "creative_direction",
      "disposition": "pass_with_findings",
      "findings": [
        "The creative direction review finds the exact automated P8 mechanism internally admissible for the evidence classes it actually exercises.",
        "The creative direction review retains every real assistive-technology, human, device, network, private, provider, field, archive, public, rollback, score, and constitutional-count boundary applicable to this seat."
      ],
      "evidence_ids": ["E-DESIGN-CONSTITUTION", "E-Q-REPORT", "E-P7-BUILD"],
      "uncertainty": "Independent physical, human, provider, field, archive, deployed, and public campaigns remain outside this automated decision.",
      "veto_ids": []
    },
    {
      "seat_id": "product_interaction",
      "disposition": "pass_with_findings",
      "findings": [
        "The product interaction review finds the exact automated P8 mechanism internally admissible for the evidence classes it actually exercises.",
        "The product interaction review retains every real assistive-technology, human, device, network, private, provider, field, archive, public, rollback, score, and constitutional-count boundary applicable to this seat."
      ],
      "evidence_ids": ["E-Q-RUNNER", "E-Q-REPORT", "E-Q-REIMPORT"],
      "uncertainty": "Independent physical, human, provider, field, archive, deployed, and public campaigns remain outside this automated decision.",
      "veto_ids": []
    },
    {
      "seat_id": "information_design",
      "disposition": "pass_with_findings",
      "findings": [
        "The information design review finds the exact automated P8 mechanism internally admissible for the evidence classes it actually exercises.",
        "The information design review retains every real assistive-technology, human, device, network, private, provider, field, archive, public, rollback, score, and constitutional-count boundary applicable to this seat."
      ],
      "evidence_ids": ["E-P7-DATA", "E-Q-REPORT", "E-Q-RUNNER"],
      "uncertainty": "Independent physical, human, provider, field, archive, deployed, and public campaigns remain outside this automated decision.",
      "veto_ids": []
    },
    {
      "seat_id": "typography",
      "disposition": "pass_with_findings",
      "findings": [
        "The typography review finds the exact automated P8 mechanism internally admissible for the evidence classes it actually exercises.",
        "The typography review retains every real assistive-technology, human, device, network, private, provider, field, archive, public, rollback, score, and constitutional-count boundary applicable to this seat."
      ],
      "evidence_ids": ["E-DESIGN-CONSTITUTION", "E-Q-REPORT"],
      "uncertainty": "Independent physical, human, provider, field, archive, deployed, and public campaigns remain outside this automated decision.",
      "veto_ids": []
    },
    {
      "seat_id": "motion",
      "disposition": "pass_with_findings",
      "findings": [
        "The motion review finds the exact automated P8 mechanism internally admissible for the evidence classes it actually exercises.",
        "The motion review retains every real assistive-technology, human, device, network, private, provider, field, archive, public, rollback, score, and constitutional-count boundary applicable to this seat."
      ],
      "evidence_ids": ["E-P7-CONTRACT", "E-Q-REPORT"],
      "uncertainty": "Independent physical, human, provider, field, archive, deployed, and public campaigns remain outside this automated decision.",
      "veto_ids": []
    },
    {
      "seat_id": "source_custody",
      "disposition": "pass",
      "findings": [
        "The source custody review finds the exact automated P8 mechanism internally admissible for the evidence classes it actually exercises.",
        "The source custody review retains every real assistive-technology, human, device, network, private, provider, field, archive, public, rollback, score, and constitutional-count boundary applicable to this seat."
      ],
      "evidence_ids": ["E-Q-REPLAY", "E-Q-REPLAY-PLAN", "E-P7-BUILD", "E-Q-REPORT"],
      "uncertainty": "Independent physical, human, provider, field, archive, deployed, and public campaigns remain outside this automated decision.",
      "veto_ids": []
    },
    {
      "seat_id": "field_operations",
      "disposition": "pass_with_findings",
      "findings": [
        "The field operations review finds the exact automated P8 mechanism internally admissible for the evidence classes it actually exercises.",
        "The field operations review retains every real assistive-technology, human, device, network, private, provider, field, archive, public, rollback, score, and constitutional-count boundary applicable to this seat."
      ],
      "evidence_ids": ["E-P7-DATA", "E-Q-REPORT", "E-P7-CONTRACT"],
      "uncertainty": "Independent physical, human, provider, field, archive, deployed, and public campaigns remain outside this automated decision.",
      "veto_ids": []
    },
    {
      "seat_id": "accessibility",
      "disposition": "pass_with_findings",
      "findings": [
        "The accessibility review finds the exact automated P8 mechanism internally admissible for the evidence classes it actually exercises.",
        "The accessibility review retains every real assistive-technology, human, device, network, private, provider, field, archive, public, rollback, score, and constitutional-count boundary applicable to this seat."
      ],
      "evidence_ids": ["E-Q-CONTRACT", "E-Q-RUNNER", "E-Q-REPORT"],
      "uncertainty": "Independent physical, human, provider, field, archive, deployed, and public campaigns remain outside this automated decision.",
      "veto_ids": []
    },
    {
      "seat_id": "performance_resilience",
      "disposition": "pass_with_findings",
      "findings": [
        "The performance resilience review finds the exact automated P8 mechanism internally admissible for the evidence classes it actually exercises.",
        "The performance resilience review retains every real assistive-technology, human, device, network, private, provider, field, archive, public, rollback, score, and constitutional-count boundary applicable to this seat."
      ],
      "evidence_ids": ["E-Q-CONTRACT", "E-Q-TESTS", "E-Q-REPORT"],
      "uncertainty": "Independent physical, human, provider, field, archive, deployed, and public campaigns remain outside this automated decision.",
      "veto_ids": []
    },
    {
      "seat_id": "security_privacy",
      "disposition": "pass",
      "findings": [
        "The security privacy review finds the exact automated P8 mechanism internally admissible for the evidence classes it actually exercises.",
        "The security privacy review retains every real assistive-technology, human, device, network, private, provider, field, archive, public, rollback, score, and constitutional-count boundary applicable to this seat."
      ],
      "evidence_ids": ["E-Q-RUNNER", "E-Q-TESTS", "E-Q-REPORT", "E-Q-REIMPORT"],
      "uncertainty": "Independent physical, human, provider, field, archive, deployed, and public campaigns remain outside this automated decision.",
      "veto_ids": []
    },
    {
      "seat_id": "continuity_release",
      "disposition": "pass_with_findings",
      "findings": [
        "The continuity release review finds the exact automated P8 mechanism internally admissible for the evidence classes it actually exercises.",
        "The continuity release review retains every real assistive-technology, human, device, network, private, provider, field, archive, public, rollback, score, and constitutional-count boundary applicable to this seat."
      ],
      "evidence_ids": ["E-Q-REPLAY-PLAN", "E-Q-REPORT", "E-Q-REIMPORT", "E-Q-WORKFLOW"],
      "uncertainty": "Independent physical, human, provider, field, archive, deployed, and public campaigns remain outside this automated decision.",
      "veto_ids": []
    }
  ],
  "defects": [],
  "vetoes": [],
  "gate_disposition": {
    "object_classification": {
      "state": "pass",
      "reason": "The object is an automated qualification matrix over the admitted P7 internal experience, rather than a public endpoint, real assistive-technology record, physical-device certification, private projection, field instrument, or release decision.",
      "evidence_ids": ["E-Q-CONTRACT", "E-Q-README", "E-Q-REPORT"]
    },
    "actors_and_authority": {
      "state": "pass",
      "reason": "Qualification operator, source custody, design integrator, contained review board, affected actors, physical campaign operators, release authority, and cold successor retain distinct evidence and decision authority.",
      "evidence_ids": ["E-Q-CONTRACT", "E-Q-README", "E-P7-CONTRACT", "E-BOARD-CHARTER"]
    },
    "mechanism_fidelity": {
      "state": "pass",